{
  "releaseBranch": "release/v1.0.0",
  "baseBranch": "main",
  "generatedAt": "2026-10-29T07:24:04.331Z",
  "totalCommits": 7,
  "totalLinesAdded": 7075,
  "totalLinesDeleted": 972,
  "totalKloc": 8.05,
  "totalBugs": 1,
  "globalDefectDensity": 0.12,
  "totalTimeSeconds": 2057,
  "totalTokens": 133225,
  "totalCostUsd": 0.7194,
  "reworkTimeSeconds": 894,
  "reworkTokens": 62980,
  "reworkCostUsd": 0.3401,
  "reworkTimePercent": 43.46,
  "reworkTokensPercent": 47.27,
  "reworkCostPercent": 47.28,
  "authorStats": [
    {
      "authorOrModel": "gemini-3.8-flash",
      "isAgent": true,
      "commits": 5,
      "linesAdded": 7075,
      "linesDeleted": 972,
      "klocProduced": 8.05,
      "bugsInjected": 1,
      "defectInjectionRate": 0.12,
      "totalTimeSeconds": 1817,
      "totalTokens": 133225,
      "estimatedCostUsd": 0.7194
    },
    {
      "authorOrModel": "Human (Alfonso Troyano Montes)",
      "isAgent": false,
      "commits": 2,
      "linesAdded": 0,
      "linesDeleted": 0,
      "klocProduced": 0,
      "bugsInjected": 0,
      "defectInjectionRate": 0,
      "totalTimeSeconds": 240,
      "totalTokens": 0,
      "estimatedCostUsd": 0
    }
  ],
  "bugList": [
    {
      "sha": "9ee9671b",
      "subject": "fix(quality): resolve open quality gate violations, schemas and BDD traceability",
      "author": "gemini-3.8-flash",
      "timeSeconds": 894,
      "tokens": 62980
    }
  ]
}